<xs:schema attributeFormDefault="unqualified" elementFormDefault="qualified" targetNamespace="https://www.w3schools.com" xmlns:xs="http://www.w3.org/2001/XMLSchema">
  <xs:element name="library">
    <xs:complexType>
      <xs:sequence>
        <xs:element name="books">
          <xs:complexType>
            <xs:sequence>
              <xs:element name="book" minOccurs="0" maxOccurs="unbounded">
                <xs:complexType>
                  <xs:sequence>
                    <xs:element type="xs:string" name="title"/>
                    <xs:element type="xs:integer" name="author"/>
                    <xs:element type="xs:string" name="state"/>
                    <xs:element type="xs:integer" name="reads"/>
                  </xs:sequence>
                  <xs:attribute type="xs:integer" name="id" use="required"/>
                  <xs:attribute type="xs:string" name="type"/>
                  <xs:attribute type="xs:string" name="ISBN"/>
                </xs:complexType>
              </xs:element>
            </xs:sequence>
          </xs:complexType>
        </xs:element>
        <xs:element name="authors">
          <xs:complexType>
            <xs:sequence>
              <xs:element name="author" minOccurs="0" maxOccurs="unbounded">
                <xs:complexType>
                  <xs:sequence>
                    <xs:element type="xs:string" name="firstname"/>
                    <xs:element type="xs:string" name="sirname"/>
                  </xs:sequence>
                  <xs:attribute type="xs:integer" name="id" use="required"/>
                </xs:complexType>
              </xs:element>
            </xs:sequence>
          </xs:complexType>
        </xs:element>
        <xs:element name="config">
          <xs:complexType>
            <xs:sequence>
              <xs:element type="xs:integer" name="nextBookId"/>
              <xs:element type="xs:integer" name="nextAuthorId"/>
            </xs:sequence>
          </xs:complexType>
        </xs:element>
      </xs:sequence>
    </xs:complexType>
  </xs:element>
</xs:schema>